{
  "$schema": "https://json-schema.org/draft/2020-12/schema",
  "$id": "https://github.com/GFCDOTA/sketchup-mcp/ground_truth/schema/expected_model.schema.json",
  "title": "Expected Floor Plan Model — Ground Truth v1",
  "description": "Manual golden-truth model used by the fidelity engine to grade an observed pipeline output. Distinct from `<plant>_micro.json` (per-room subset) and from `tests/baselines/<plant>.json` (deterministic count baseline). v1 is intentionally minimal: rooms + openings + adjacency + global_bbox. Polygon-perfect IoU, materials, mobiliario, exact wall geometry are out of scope for v1 — they belong to v2.",
  "type": "object",
  "required": [
    "schema_version",
    "plan_id",
    "unit",
    "rooms"
  ],
  "additionalProperties": true,
  "properties": {
    "schema_version": {
      "type": "string",
      "const": "1.0",
      "description": "Bumped on breaking schema changes only. v1 = this file."
    },
    "plan_id": {
      "type": "string",
      "description": "Identifier for the plant, e.g. 'planta_74'."
    },
    "source_pdf": {
      "type": "string",
      "description": "Path to the original PDF that this expected model describes."
    },
    "unit": {
      "type": "string",
      "enum": ["m", "mm"],
      "description": "All length / area units. v1 expects 'm' (meters) and area in m^2; 'mm' reserved for future."
    },
    "scale_source": {
      "type": "string",
      "description": "How the unit anchor was established. Free text. E.g. 'wall_thickness_pts=5.4 mapped to 0.19 m via PT_TO_M=0.0352'."
    },
    "global_bbox": {
      "type": "object",
      "description": "Outer bounding box of the apartment footprint, in `unit`. Used by the fidelity engine to detect global-scale drift.",
      "required": ["width", "height"],
      "additionalProperties": false,
      "properties": {
        "width": {
          "type": "number",
          "minimum": 0,
          "description": "Width of the apartment footprint."
        },
        "height": {
          "type": "number",
          "minimum": 0,
          "description": "Height of the apartment footprint."
        },
        "tolerance_pct": {
          "type": "number",
          "minimum": 0,
          "maximum": 100,
          "default": 10,
          "description": "% drift allowed before bbox is flagged. Default 10."
        }
      }
    },
    "expected_counts": {
      "type": "object",
      "description": "Top-level counts the observed model must roughly match.",
      "additionalProperties": false,
      "properties": {
        "rooms": { "type": "integer", "minimum": 0 },
        "openings": { "type": "integer", "minimum": 0 },
        "walls": { "type": "integer", "minimum": 0 },
        "tolerance": {
          "type": "object",
          "additionalProperties": false,
          "properties": {
            "rooms_delta": { "type": "integer", "minimum": 0, "default": 1 },
            "openings_delta": { "type": "integer", "minimum": 0, "default": 2 },
            "walls_delta": { "type": "integer", "minimum": 0, "default": 4 }
          }
        }
      }
    },
    "rooms": {
      "type": "array",
      "minItems": 1,
      "items": { "$ref": "#/$defs/room" }
    },
    "openings": {
      "type": "array",
      "default": [],
      "items": { "$ref": "#/$defs/opening" }
    },
    "adjacency": {
      "type": "array",
      "default": [],
      "description": "List of expected room-to-room edges. Used by adjacency_f1.",
      "items": { "$ref": "#/$defs/adjacency_edge" }
    },
    "notes": {
      "type": "array",
      "items": { "type": "string" },
      "description": "Free-text notes for human reviewers. Not consumed by fidelity scoring."
    }
  },
  "$defs": {
    "room": {
      "type": "object",
      "required": ["id", "label"],
      "additionalProperties": false,
      "properties": {
        "id": {
          "type": "string",
          "pattern": "^[a-zA-Z][a-zA-Z0-9_]*$",
          "description": "Stable id for cross-reference (adjacency, openings.connects)."
        },
        "label": {
          "type": "string",
          "description": "Human-readable label as it appears (or should appear) in the consensus.rooms[].name."
        },
        "expected_area_m2_range": {
          "type": "array",
          "minItems": 2,
          "maxItems": 2,
          "items": { "type": "number", "minimum": 0 },
          "description": "[lo, hi] inclusive. Hard-fails the room when the observed area falls outside."
        },
        "expected_bbox_m": {
          "type": "object",
          "description": "Approximate room bbox in meters. Optional; used for visual overlays only in v1.",
          "additionalProperties": false,
          "properties": {
            "width": { "type": "number", "minimum": 0 },
            "height": { "type": "number", "minimum": 0 }
          }
        },
        "polygon_m": {
          "type": "array",
          "description": "Optional manual polygon in meters. Reserved for v2 IoU.",
          "items": {
            "type": "array",
            "minItems": 2,
            "maxItems": 2,
            "items": { "type": "number" }
          }
        },
        "must_be_closed": {
          "type": "boolean",
          "default": true,
          "description": "Hard-fail if observed polygon is not a closed loop with >= 3 distinct vertices."
        },
        "manual_confidence": {
          "type": "string",
          "enum": ["low", "medium", "high"],
          "default": "medium",
          "description": "Annotator's confidence in this entry. Affects the fidelity engine's `weight` only; never silently drops the room."
        },
        "source": {
          "type": "string",
          "description": "How this row was authored. E.g. 'manual review of planta_74.pdf 2026-05-07' or 'derived from observed + manual area correction'."
        },
        "notes": {
          "type": "array",
          "items": { "type": "string" }
        }
      }
    },
    "opening": {
      "type": "object",
      "required": ["id", "kind"],
      "additionalProperties": false,
      "properties": {
        "id": {
          "type": "string",
          "pattern": "^[a-zA-Z][a-zA-Z0-9_]*$"
        },
        "kind": {
          "type": "string",
          "enum": [
            "interior_door",
            "interior_passage",
            "exterior_door",
            "window",
            "glazed_balcony",
            "unknown"
          ]
        },
        "expected_width_m": {
          "type": "number",
          "minimum": 0,
          "description": "Optional. Reserved for v2 width-error metric."
        },
        "expected_width_m_range": {
          "type": "array",
          "minItems": 2,
          "maxItems": 2,
          "items": { "type": "number", "minimum": 0 }
        },
        "connects": {
          "type": "array",
          "minItems": 1,
          "maxItems": 2,
          "items": { "type": "string" },
          "description": "Room ids this opening connects. Length 2 for interior, length 1 for exterior."
        },
        "manual_confidence": {
          "type": "string",
          "enum": ["low", "medium", "high"],
          "default": "medium"
        },
        "notes": {
          "type": "array",
          "items": { "type": "string" }
        }
      }
    },
    "adjacency_edge": {
      "type": "object",
      "required": ["a", "b"],
      "additionalProperties": false,
      "properties": {
        "a": { "type": "string", "description": "Room id A." },
        "b": { "type": "string", "description": "Room id B." },
        "via": {
          "type": "string",
          "description": "Opening id (from `openings`) that materializes this adjacency. Optional in v1."
        },
        "kind": {
          "type": "string",
          "enum": [
            "interior_door",
            "interior_passage",
            "open",
            "glazed_balcony",
            "unknown"
          ],
          "description": "How rooms touch. v1 uses this only as informational; adjacency_f1 only checks (a, b) presence."
        },
        "manual_confidence": {
          "type": "string",
          "enum": ["low", "medium", "high"],
          "default": "medium"
        }
      }
    }
  }
}
