{
  "schema_version": "1.0",
  "plan_id": "synth_plus4",
  "source_pdf": "(generated by tools.synth.make_synthetic_vector_pdf --spec plus4)",
  "unit": "m",
  "scale_source": "synthetic — PDF user space units treated as PT_TO_M=0.0352 like planta_74; not physically anchored",
  "global_bbox": {
    "width": 16.2,
    "height": 8.5,
    "tolerance_pct": 25
  },
  "expected_counts": {
    "rooms": 4,
    "openings": 3,
    "walls": 16,
    "tolerance": {
      "rooms_delta": 0,
      "openings_delta": 1,
      "walls_delta": 4
    }
  },
  "rooms": [
    {
      "id": "sala_p",
      "label": "SALA P",
      "expected_area_m2_range": [10.0, 35.0],
      "must_be_closed": true,
      "manual_confidence": "medium",
      "source": "synthetic — CENTER box in EXAMPLE_SPEC_4_ROOM_PLUS"
    },
    {
      "id": "quarto_n",
      "label": "QUARTO N",
      "expected_area_m2_range": [5.0, 25.0],
      "must_be_closed": true,
      "manual_confidence": "medium",
      "source": "synthetic — NORTH wing in EXAMPLE_SPEC_4_ROOM_PLUS"
    },
    {
      "id": "quarto_w",
      "label": "QUARTO W",
      "expected_area_m2_range": [5.0, 25.0],
      "must_be_closed": true,
      "manual_confidence": "medium",
      "source": "synthetic — WEST wing in EXAMPLE_SPEC_4_ROOM_PLUS"
    },
    {
      "id": "quarto_e",
      "label": "QUARTO E",
      "expected_area_m2_range": [5.0, 25.0],
      "must_be_closed": true,
      "manual_confidence": "medium",
      "source": "synthetic — EAST wing in EXAMPLE_SPEC_4_ROOM_PLUS"
    }
  ],
  "openings": [
    {
      "id": "op_sala_quarto_n",
      "kind": "interior_passage",
      "connects": ["sala_p", "quarto_n"],
      "manual_confidence": "high",
      "notes": ["50-pt wall_gap on the H divider between CENTER and NORTH wing."]
    },
    {
      "id": "op_sala_quarto_w",
      "kind": "interior_passage",
      "connects": ["sala_p", "quarto_w"],
      "manual_confidence": "high",
      "notes": ["50-pt wall_gap on the V divider between CENTER and WEST wing."]
    },
    {
      "id": "op_sala_quarto_e",
      "kind": "interior_passage",
      "connects": ["sala_p", "quarto_e"],
      "manual_confidence": "high",
      "notes": ["50-pt wall_gap on the V divider between CENTER and EAST wing."]
    }
  ],
  "adjacency": [
    {"a": "sala_p", "b": "quarto_n", "via": "op_sala_quarto_n", "kind": "interior_passage", "manual_confidence": "high"},
    {"a": "sala_p", "b": "quarto_w", "via": "op_sala_quarto_w", "kind": "interior_passage", "manual_confidence": "high"},
    {"a": "sala_p", "b": "quarto_e", "via": "op_sala_quarto_e", "kind": "interior_passage", "manual_confidence": "high"}
  ],
  "notes": [
    "Cycle 11e (2026-05-08) — synthetic ground truth paired with",
    "tools.synth.make_synthetic_vector_pdf --spec plus4 (4-room cross).",
    "One central SALA + 3 wings (N, W, E). South side of CENTER is",
    "closed by an exterior wall; the 4th arm of a true PLUS is omitted",
    "to give a clean, reachable topology. Round-trip test runs the",
    "pipeline with --no-concave-hull (concave-hull would carve the",
    "T/cross envelope into broken polygons because the wall outline",
    "traces inward at every wing junction)."
  ]
}
