{
  "schema_version": "1.0",
  "plan_id": "synth_hall5",
  "source_pdf": "(generated by tools.synth.make_synthetic_vector_pdf --spec hall5)",
  "unit": "m",
  "scale_source": "synthetic — PDF user space units treated as PT_TO_M=0.0352 like planta_74; not physically anchored",
  "global_bbox": {
    "width": 28.2,
    "height": 5.6,
    "tolerance_pct": 25
  },
  "expected_counts": {
    "rooms": 5,
    "openings": 4,
    "walls": 12,
    "tolerance": {
      "rooms_delta": 0,
      "openings_delta": 1,
      "walls_delta": 4
    }
  },
  "rooms": [
    {
      "id": "sala_h",
      "label": "SALA H",
      "expected_area_m2_range": [15.0, 40.0],
      "must_be_closed": true,
      "manual_confidence": "medium",
      "source": "synthetic — R1 (leftmost) in EXAMPLE_SPEC_5_LONG_HALL"
    },
    {
      "id": "quarto_h",
      "label": "QUARTO H",
      "expected_area_m2_range": [15.0, 40.0],
      "must_be_closed": true,
      "manual_confidence": "medium",
      "source": "synthetic — R2 in EXAMPLE_SPEC_5_LONG_HALL"
    },
    {
      "id": "cozinha_h",
      "label": "COZINHA H",
      "expected_area_m2_range": [15.0, 40.0],
      "must_be_closed": true,
      "manual_confidence": "medium",
      "source": "synthetic — R3 (middle) in EXAMPLE_SPEC_5_LONG_HALL"
    },
    {
      "id": "suite_h",
      "label": "SUITE H",
      "expected_area_m2_range": [15.0, 40.0],
      "must_be_closed": true,
      "manual_confidence": "medium",
      "source": "synthetic — R4 in EXAMPLE_SPEC_5_LONG_HALL"
    },
    {
      "id": "lavabo_h",
      "label": "LAVABO H",
      "expected_area_m2_range": [15.0, 40.0],
      "must_be_closed": true,
      "manual_confidence": "medium",
      "source": "synthetic — R5 (rightmost) in EXAMPLE_SPEC_5_LONG_HALL"
    }
  ],
  "openings": [
    {
      "id": "op_sala_quarto",
      "kind": "interior_passage",
      "connects": ["sala_h", "quarto_h"],
      "manual_confidence": "high",
      "notes": ["35-pt wall_gap between R1 (SALA H) and R2 (QUARTO H)."]
    },
    {
      "id": "op_quarto_cozinha",
      "kind": "interior_passage",
      "connects": ["quarto_h", "cozinha_h"],
      "manual_confidence": "high",
      "notes": ["35-pt wall_gap between R2 and R3."]
    },
    {
      "id": "op_cozinha_suite",
      "kind": "interior_passage",
      "connects": ["cozinha_h", "suite_h"],
      "manual_confidence": "high",
      "notes": ["35-pt wall_gap between R3 and R4."]
    },
    {
      "id": "op_suite_lavabo",
      "kind": "interior_door",
      "connects": ["suite_h", "lavabo_h"],
      "manual_confidence": "high",
      "notes": [
        "35-pt wall_gap between R4 (SUITE H) and R5 (LAVABO H).",
        "Both rooms private, so V5 classifier emits interior_door",
        "(within PRIVATE_PAIR_DOOR_MAX_M=1.50 m at 35*0.0352=1.23 m)."
      ]
    }
  ],
  "adjacency": [
    {"a": "sala_h", "b": "quarto_h", "via": "op_sala_quarto", "kind": "interior_passage", "manual_confidence": "high"},
    {"a": "quarto_h", "b": "cozinha_h", "via": "op_quarto_cozinha", "kind": "interior_passage", "manual_confidence": "high"},
    {"a": "cozinha_h", "b": "suite_h", "via": "op_cozinha_suite", "kind": "interior_passage", "manual_confidence": "high"},
    {"a": "suite_h", "b": "lavabo_h", "via": "op_suite_lavabo", "kind": "interior_door", "manual_confidence": "high"}
  ],
  "notes": [
    "Cycle 11e (2026-05-08) — synthetic ground truth paired with",
    "tools.synth.make_synthetic_vector_pdf --spec hall5 (5-room",
    "long-hall corridor). Mixed room types (SALA, QUARTO, COZINHA,",
    "SUITE, LAVABO) so the V5 room-context classifier doesn't reject",
    "every gap as 'private<->private wider than 1.50 m' (the all-",
    "QUARTO variant emitted 4 dropped openings on first build).",
    "Each gap is 35 pt = 1.23 m: under 1.20 m would be interior_door",
    "for non-private pairs, but 1.23 m lands at interior_passage for",
    "any pair containing one public room."
  ]
}
